Unnamed: 0,Question,Answer,Subgraph1,Subgraph2,hop_count
5,"Did the unemployment rate in the euro area remain broadly unchanged after the region reached its pre-pandemic level, which was equal to the fourth quarter of 2019, despite the United States raising policy interest rates to higher levels than the euro area during the same period?","Yes, the unemployment rate in the euro area remained broadly unchanged after the region reached its pre-pandemic level, which was equal to the fourth quarter of 2019, even though the United States raised policy interest rates to higher levels than the euro area. However, the unemployment rate in the euro area still exceeds the pre-pandemic level after a prior decline.",(:euro_area {id: e375})-[:reached]->(:pre_pandemic_level {id: e3321})-[:after_decline]->(:decline {id: e2038}),(:euro_area {id: e375})-[:reached]->(:pre_pandemic_level {id: e3321})-[:equal_to]->(:fourth_quarter_of_2019 {id: e538})-[:part_of]->(:United_States {id: e230})-[:policy_interest_rates_raised_to_higher_levels_than]->(:euro_area {id: e375})-[:broadly_unchanged]->(:unemployment_rate {id: e1752})-[:exceeds_level]->(:pre_pandemic_level {id: e3321})-[:after_decline]->(:decline {id: e2038}),7
6,"What economic milestone did the Euro Area achieve after a decline and how does its unemployment rate compare to the pre-pandemic level, considering the time reference for the pre-pandemic level being the fourth quarter of 2019?","The Euro Area reached its pre-pandemic level after a decline, and the unemployment rate in the Euro Area broadly remained unchanged, exceeding the level it was at after the decline, with the reference for the pre-pandemic level being the fourth quarter of 2019.",(:euro_area {id: e375})-[:reached]->(:pre_pandemic_level {id: e3321})-[:after_decline]->(:decline {id: e2038}),(:euro_area {id: e375})-[:reached]->(:pre_pandemic_level {id: e3321})-[:from]->(:fourth_quarter_of_2019 {id: e538})-[:part_of]->(:United_States {id: e230})-[:has_difference_with]->(:euro_area {id: e375})-[:broadly_unchanged]->(:unemployment_rate {id: e1752})-[:exceeds_level]->(:pre_pandemic_level {id: e3321})-[:after_decline]->(:decline {id: e2038}),7
7,"Did the euro area reach the pre-pandemic level of economic activity after a decline and did this occur before or after the fourth quarter of 2019, and how has the unemployment rate in the euro area changed in relation to the pre-pandemic level?","Yes, the euro area reached the pre-pandemic level of economic activity after a decline. This occurred after the fourth quarter of 2019, which is part of the United States' timeframe. The unemployment rate in the euro area has remained broadly unchanged and exceeds the pre-pandemic level following the decline.",(:euro_area {id: e375})-[:reached]->(:pre_pandemic_level {id: e3321})-[:after_decline]->(:decline {id: e2038}),(:euro_area {id: e375})-[:reached]->(:pre_pandemic_level {id: e3321})-[:from]->(:fourth_quarter_of_2019 {id: e538})-[:part_of]->(:United_States {id: e230})-[:aligned_with]->(:euro_area {id: e375})-[:broadly_unchanged]->(:unemployment_rate {id: e1752})-[:exceeds_level]->(:pre_pandemic_level {id: e3321})-[:after_decline]->(:decline {id: e2038}),7
8,"How did the war in Ukraine affect the Euro area's economy in terms of imports and what economic indicator surpassed pre-pandemic levels after a decline, potentially due to job retention schemes?","The war in Ukraine negatively affected the Euro area's economic activity due to its impact on fertiliser imports. Meanwhile, the unemployment rate in the Euro area exceeded the pre-pandemic level after a decline, which was influenced by the initiation of job retention schemes.",(:euro_area {id: e375})-[:reached]->(:pre_pandemic_level {id: e3321})-[:after_decline]->(:decline {id: e2038}),(:euro_area {id: e375})-[:imports_affected_by]->(:fertilisers {id: e15729})-[:related_to]->(:war_in_Ukraine {id: e10173})-[:negatively_affected]->(:economic_activity {id: e1381})-[:picked_up_when]->(:job_retention_schemes {id: e3625})-[:pose_risk_to]->(:unemployment_rate {id: e1752})-[:exceeds_level]->(:pre_pandemic_level {id: e3321})-[:after_decline]->(:decline {id: e2038}),8
9,"Did the Euro area reach the pre-pandemic level of economic activity after experiencing a decline, and how have the war in Ukraine and the unemployment rate been factors in its economic status?","The Euro area did reach the pre-pandemic level of economic activity after experiencing a decline. However, imports of fertilisers in the Euro area, which have been affected by the war in Ukraine, negatively impacted the region's economic activity. Despite these challenges, the unemployment rate in the Euro area has remained broadly unchanged and continues to exceed the pre-pandemic level following the decline.",(:euro_area {id: e375})-[:reached]->(:pre_pandemic_level {id: e3321})-[:after_decline]->(:decline {id: e2038}),(:euro_area {id: e375})-[:imports_affected_by]->(:fertilisers {id: e15729})-[:related_to]->(:war_in_Ukraine {id: e10173})-[:negatively_affected]->(:economic_activity {id: e1381})-[:experienced_contraction_in]->(:euro_area {id: e375})-[:broadly_unchanged]->(:unemployment_rate {id: e1752})-[:exceeds_level]->(:pre_pandemic_level {id: e3321})-[:after_decline]->(:decline {id: e2038}),8
0,"How did the financial conditions relevant to firms in the euro area continue to tighten, and what policy measures supported by which institution played a role in this context, amidst which country's residents did scepticism towards these measures remain a minority attitude, even as the region experienced strong house price dynamics?","The financial conditions relevant to firms in the euro area continued to tighten due to ongoing economic circumstances. These tightening conditions were supported by policy measures implemented by the European Central Bank (ECB). Despite these measures, scepticism remained a minority attitude in Austria, a country which, like the rest of the euro area, experienced strong house price dynamics.",(:firms {id: e232})-[:relevance_of_moderation]->(:financial_conditions {id: e173})-[:continued_to_tighten]->(:euro_area {id: e375}),(:firms {id: e232})-[:relevance_of_moderation]->(:financial_conditions {id: e173})-[:continued_to_tighten]->(:euro_area {id: e375})-[:supported_by]->(:policy_measures {id: e2828})-[:implement_by]->(:ECB {id: e849})-[:scepticism_remained_minority_attitude_in]->(:Austria {id: e3077})-[:experienced_strong_house_price_dynamics]->(:euro_area {id: e375}),6
1,"How have the financial conditions which firms find relevant impacted the euro area according to the data, and what is the effect observed in the euro area's surplus as per the BEA compared to the ECB's perspective, also considering the housing market situation in Austria?","The relevant financial conditions for firms have continued to tighten in the euro area. According to the BEA, this tightening has led to a smaller surplus in the euro area. Conversely, while the ECB may have a different perspective, there is no substantive scepticism in Austria, where skepticism remained a minority attitude, even as the country experienced strong house price dynamics within the euro area.",(:firms {id: e232})-[:relevance_of_moderation]->(:financial_conditions {id: e173})-[:continued_to_tighten]->(:euro_area {id: e375}),(:firms {id: e232})-[:relevance_of_moderation]->(:financial_conditions {id: e173})-[:continued_to_tighten]->(:euro_area {id: e375})-[:smaller_surplus_according_to]->(:BEA {id: e8001})-[:Comparison_entity]->(:ECB {id: e849})-[:scepticism_remained_minority_attitude_in]->(:Austria {id: e3077})-[:experienced_strong_house_price_dynamics]->(:euro_area {id: e375}),6
2,"Did firms find the tightening of financial conditions in the Euro area, where Austria experienced strong house price dynamics and skepticism towards ECB data remained a minority attitude, to be of significance?","Yes, firms found the tightening of financial conditions in the Euro area to be of relevance. This area includes Austria, where skepticism towards ECB data remained a minority attitude and where strong house price dynamics were experienced.",(:firms {id: e232})-[:relevance_of_moderation]->(:financial_conditions {id: e173})-[:continued_to_tighten]->(:euro_area {id: e375}),(:firms {id: e232})-[:relevance_of_moderation]->(:financial_conditions {id: e173})-[:continued_to_tighten]->(:euro_area {id: e375})-[:Data_source]->(:ECB {id: e849})-[:scepticism_remained_minority_attitude_in]->(:Austria {id: e3077})-[:experienced_strong_house_price_dynamics]->(:euro_area {id: e375}),5
3,"How have the financial conditions relevant to firms in the euro area evolved, and what is the connection between the ECB's data on the euro and housing price dynamics in Austria?","The financial conditions that are relevant to firms have continued to tighten in the euro area. According to the data sourced from the ECB, there is a divergence with the euro. Despite this divergence, scepticism remained a minority attitude in Austria, which has experienced strong house price dynamics within the euro area.",(:firms {id: e232})-[:relevance_of_moderation]->(:financial_conditions {id: e173})-[:continued_to_tighten]->(:euro_area {id: e375}),(:firms {id: e232})-[:relevance_of_moderation]->(:financial_conditions {id: e173})-[:continued_to_tighten]->(:euro_area {id: e375})-[:Data_source]->(:ECB {id: e849})-[:divergence_with]->(:euro {id: e70})-[:scepticism_remained_minority_attitude_in]->(:Austria {id: e3077})-[:experienced_strong_house_price_dynamics]->(:euro_area {id: e375}),6
4,"Did the firms observe tightening financial conditions in the euro area, and what policy measures supported those conditions while skepticism about those measures remained a minority attitude in Austria, which experienced strong house price dynamics?","Yes, the firms observed that financial conditions in the euro area continued to tighten. These conditions were supported by policy measures implemented by the ECB. In Austria, skepticism towards these measures remained a minority attitude, despite the country experiencing strong house price dynamics in the euro area.",(:firms {id: e232})-[:relevance_of_moderation]->(:financial_conditions {id: e173})-[:continued_to_tighten]->(:euro_area {id: e375}),(:firms {id: e232})-[:relevance_of_moderation]->(:financial_conditions {id: e173})-[:observed_in_location]->(:euro_area {id: e375})-[:supported_by]->(:policy_measures {id: e2828})-[:implement_by]->(:ECB {id: e849})-[:scepticism_remained_minority_attitude_in]->(:Austria {id: e3077})-[:experienced_strong_house_price_dynamics]->(:euro_area {id: e375}),7
5,"How has the relevance of moderation by firms in the euro area been linked to financial conditions, and what policy measures have supported these conditions amidst the tightening observed, particularly noting the attitude in Austria towards the implementing body?","The relevance of moderation by firms in the euro area has been linked to financial conditions that have continued to tighten. These financial conditions have been observed in the euro area and have been supported by policy measures implemented by the European Central Bank (ECB). In Austria, where strong house price dynamics have been experienced, scepticism towards the ECB remained a minority attitude, indicating general support or acceptance of the ECB's policy measures within the country.",(:firms {id: e232})-[:relevance_of_moderation]->(:financial_conditions {id: e173})-[:continued_to_tighten]->(:euro_area {id: e375}),(:firms {id: e232})-[:relevance_of_moderation]->(:financial_conditions {id: e173})-[:observed_in_location]->(:euro_area {id: e375})-[:supported_by]->(:policy_measures {id: e2828})-[:implemented_by]->(:ECB {id: e849})-[:scepticism_remained_minority_attitude_in]->(:Austria {id: e3077})-[:experienced_strong_house_price_dynamics]->(:euro_area {id: e375}),7
6,"Did the financial conditions that were relevant to firms in the euro area continue to tighten and were these conditions observed across the entire euro area, which also reported a smaller surplus according to BEA in comparison to ECB's reports and while scepticism remained a minority attitude in Austria where strong house price dynamics were experienced?","Yes, the financial conditions relevant to firms in the euro area continued to tighten and these conditions were observed across the entire euro area. Additionally, the euro area reported a smaller surplus according to BEA in comparison to ECB's reports, and while scepticism remained a minority attitude in Austria, the country experienced strong house price dynamics within the euro area.",(:firms {id: e232})-[:relevance_of_moderation]->(:financial_conditions {id: e173})-[:continued_to_tighten]->(:euro_area {id: e375}),(:firms {id: e232})-[:relevance_of_moderation]->(:financial_conditions {id: e173})-[:observed_in_location]->(:euro_area {id: e375})-[:smaller_surplus_according_to]->(:BEA {id: e8001})-[:Comparison_entity]->(:ECB {id: e849})-[:scepticism_remained_minority_attitude_in]->(:Austria {id: e3077})-[:experienced_strong_house_price_dynamics]->(:euro_area {id: e375}),7
7,"How have financial conditions in the euro area been affected according to firms, and what attitude did the European Central Bank (ECB) observe in Austria regarding these conditions amidst strong house price dynamics in the euro area?","Financial conditions in the euro area have continued to tighten, and this moderation's relevance was observed by firms. In Austria, despite the strong house price dynamics experienced within the euro area, scepticism remained a minority attitude, as noted by data from the ECB.",(:firms {id: e232})-[:relevance_of_moderation]->(:financial_conditions {id: e173})-[:continued_to_tighten]->(:euro_area {id: e375}),(:firms {id: e232})-[:relevance_of_moderation]->(:financial_conditions {id: e173})-[:observed_in_location]->(:euro_area {id: e375})-[:Data_source]->(:ECB {id: e849})-[:scepticism_remained_minority_attitude_in]->(:Austria {id: e3077})-[:experienced_strong_house_price_dynamics]->(:euro_area {id: e375}),6
8,"How have financial conditions relevant to firms in the euro area evolved according to data from the ECB, and what minority attitude towards the euro is observed in Austria despite the strong house price dynamics in the euro area?","Financial conditions relevant to firms in the euro area have continued to tighten, and this observation has been made in the euro area according to data from the ECB. Despite this tightening and the experienced strong house price dynamics in the euro area, scepticism towards the euro remained a minority attitude in Austria.",(:firms {id: e232})-[:relevance_of_moderation]->(:financial_conditions {id: e173})-[:continued_to_tighten]->(:euro_area {id: e375}),(:firms {id: e232})-[:relevance_of_moderation]->(:financial_conditions {id: e173})-[:observed_in_location]->(:euro_area {id: e375})-[:Data_source]->(:ECB {id: e849})-[:divergence_with]->(:euro {id: e70})-[:scepticism_remained_minority_attitude_in]->(:Austria {id: e3077})-[:experienced_strong_house_price_dynamics]->(:euro_area {id: e375}),7
9,"How have the financial conditions relevant to firms identified with ID e232 evolved differently in the euro area compared to other advanced economies outside of the euro area, and what specific economic phenomenon related to house prices has Austria experienced within the euro area according to ECB data?","The financial conditions relevant to firms with ID e232 have continued to tighten in the euro area, while they remain supportive in other advanced economies outside of the euro area. According to ECB data, Austria, which is within the euro area, has experienced strong house price dynamics.",(:firms {id: e232})-[:relevance_of_moderation]->(:financial_conditions {id: e173})-[:continued_to_tighten]->(:euro_area {id: e375}),(:firms {id: e232})-[:relevance_of_moderation]->(:financial_conditions {id: e173})-[:remain_supportive_in]->(:advanced_economies {id: e5328})-[:is_outside_of]->(:euro_area {id: e375})-[:Data_source]->(:ECB {id: e849})-[:scepticism_remained_minority_attitude_in]->(:Austria {id: e3077})-[:experienced_strong_house_price_dynamics]->(:euro_area {id: e375}),7
0,"How does the Governing Council's previous assessment of baseline inflation impact public finances according to Section 3 of a certain article, and what is the relationship between the exchange rate and industries that the same Council monitors?","The Governing Council's previous assessment of baseline inflation has an impact on public finances, as indicated by the chain of relationships where the impact of inflation affects public finances, and then a reaction is based on Section 3 of a particular article. Furthermore, the exchange rate, which corroborates the findings in the article related to the assessment, depends on industries, and this same exchange rate is also monitored by the Governing Council.",(:Governing_Council {id: e150})-[:previous_assessment]->(:baseline_assessment {id: e1603})-[:impact_on]->(:inflation {id: e108})-[:affects]->(:public_finances {id: e9354})-[:reaction_based_on]->(:Section_3 {id: e4755})-[:section_of]->(:article {id: e1193})-[:corroborates_finding]->(:exchange_rate {id: e1616})-[:R_depend_on]->(:industries {id: e15189}),(:Governing_Council {id: e150})-[:monitors]->(:exchange_rate {id: e1616})-[:R_depend_on]->(:industries {id: e15189}),8
1,How does the Governing Council's previous assessment of the baseline assessment's impact on inflation relate to public finances and the monitoring of exchange rates which are dependent on industries?,"The Governing Council's previous assessment, through a baseline assessment, found that inflation had a bidirectional relationship with public finances. This interconnection is further informed by Section 3 of an article, which reacts to this relationship and corroborates the findings concerning the exchange rate. Moreover, the Governing Council also monitors the exchange rate, which is dependent on industries, thus indicating a complex interplay where inflation, public finances, exchange rates, and industrial performance are all interrelated and influence each other.",(:Governing_Council {id: e150})-[:previous_assessment]->(:baseline_assessment {id: e1603})-[:impact_on]->(:inflation {id: e108})-[:bidirectional_relationship]->(:public_finances {id: e9354})-[:reaction_based_on]->(:Section_3 {id: e4755})-[:section_of]->(:article {id: e1193})-[:corroborates_finding]->(:exchange_rate {id: e1616})-[:R_depend_on]->(:industries {id: e15189}),(:Governing_Council {id: e150})-[:monitors]->(:exchange_rate {id: e1616})-[:R_depend_on]->(:industries {id: e15189}),8
2,How does the Governing Council's monitoring of the exchange rate correlate with the reaction of public finances as outlined in Section 3 of an article that also supports findings on industries depending on the exchange rate?,"The Governing Council ensures the monetary policy which aims for inflation control and has a bidirectional relationship with public finances. Public finances react based on Section 3 of an article that corroborates findings on the dependence of industries on the exchange rate, which the Governing Council monitors. This monitoring is significant because the exchange rate has a direct impact on industries, as indicated by their dependency on it. Therefore, the Governing Council's actions regarding monetary policy and exchange rate monitoring are interconnected with the reactions of public finances and the economic stability of industries.",(:Governing_Council {id: e150})-[:ensure]->(:monetary_policy {id: e1227})-[:aims_for]->(:inflation {id: e108})-[:bidirectional_relationship]->(:public_finances {id: e9354})-[:reaction_based_on]->(:Section_3 {id: e4755})-[:section_of]->(:article {id: e1193})-[:corroborates_finding]->(:exchange_rate {id: e1616})-[:R_depend_on]->(:industries {id: e15189}),(:Governing_Council {id: e150})-[:monitors]->(:exchange_rate {id: e1616})-[:R_depend_on]->(:industries {id: e15189}),8
3,How does the Governing Council's role in ensuring inflation relate to its monitoring of the exchange rate and the impact on industries?,"The Governing Council ensures inflation and also monitors the exchange rate, which is corroborated by an article that establishes a bidirectional relationship with public finances and reacts based on Section 3. This exchange rate has a dependent relationship with industries, highlighting the significance of the Governing Council's dual role in stabilizing inflation and its repercussions on exchange rates, which in turn affect industries.",(:Governing_Council {id: e150})-[:ensure]->(:inflation {id: e108})-[:bidirectional_relationship]->(:public_finances {id: e9354})-[:reaction_based_on]->(:Section_3 {id: e4755})-[:section_of]->(:article {id: e1193})-[:corroborates_finding]->(:exchange_rate {id: e1616})-[:R_depend_on]->(:industries {id: e15189}),(:Governing_Council {id: e150})-[:monitors]->(:exchange_rate {id: e1616})-[:R_depend_on]->(:industries {id: e15189}),7
4,How does the Governing Council's involvement with inflation relate to its monitoring of the exchange rate and the impact on industries?,"The Governing Council ensures measures to control inflation, which has a bidirectional relationship with public finances. This relationship is informed by Section 3 of a certain article, which corroborates findings relevant to the exchange rate. The exchange rate, monitored by the Governing Council, is crucial as it depends on and affects various industries.",(:Governing_Council {id: e150})-[:ensure]->(:inflation {id: e108})-[:increased]->(:inflation {id: e108})-[:bidirectional_relationship]->(:public_finances {id: e9354})-[:reaction_based_on]->(:Section_3 {id: e4755})-[:section_of]->(:article {id: e1193})-[:corroborates_finding]->(:exchange_rate {id: e1616})-[:R_depend_on]->(:industries {id: e15189}),(:Governing_Council {id: e150})-[:monitors]->(:exchange_rate {id: e1616})-[:R_depend_on]->(:industries {id: e15189}),8
5,How does the Governing Council's confirmation of policy measures relate to potential employment creation through planned investments according to the findings noted in an article section?,"The Governing Council (id: e150) confirmed policy measures (id: e2828) that are introduced to potentially create employment (id: e4800). These employment opportunities may be created by planned investments (id: e4798), the potential of which was noted in Section 3 (id: e4755) of an article (id: e1193). The findings in the article correlate with the dependency of industries (id: e15189) on the exchange rate (id: e1616), which the Governing Council also monitors.",(:Governing_Council {id: e150})-[:confirmed]->(:policy_measures {id: e2828})-[:introduced_to]->(:Employment {id: e4800})-[:may_be_created_by]->(:Planned_investments {id: e4798})-[:reinforcement_potential_noted_in]->(:Section_3 {id: e4755})-[:section_of]->(:article {id: e1193})-[:corroborates_finding]->(:exchange_rate {id: e1616})-[:R_depend_on]->(:industries {id: e15189}),(:Governing_Council {id: e150})-[:monitors]->(:exchange_rate {id: e1616})-[:R_depend_on]->(:industries {id: e15189}),8
6,How does the Governing Council's approach to maintaining flexibility in its monetary policy relate to its monitoring of the exchange rate and its impact on industries?,"The Governing Council maintains flexibility in its monetary policy to address inflation, which affects public finances. Their response is guided by Section 3 of an article that corroborates findings related to the exchange rate. Furthermore, the exchange rate depends on various industries, which are also directly monitored by the Governing Council. This closed-loop approach shows that the Council’s monetary policy, while being adaptive to inflation, also considers the exchange rate's influence on industries, thus ensuring that the policy is comprehensive and responsive to economic conditions.",(:Governing_Council {id: e150})-[:will_maintain_in_monetary_policy]->(:flexibility {id: e5247})-[:warranted_for]->(:inflation {id: e108})-[:affects]->(:public_finances {id: e9354})-[:reaction_based_on]->(:Section_3 {id: e4755})-[:section_of]->(:article {id: e1193})-[:corroborates_finding]->(:exchange_rate {id: e1616})-[:R_depend_on]->(:industries {id: e15189}),(:Governing_Council {id: e150})-[:monitors]->(:exchange_rate {id: e1616})-[:R_depend_on]->(:industries {id: e15189}),8
7,How does the Governing Council's commitment to maintaining flexibility in monetary policy relate to inflation and its impact on public finances and industries through the exchange rate monitored by the Council?,"The Governing Council maintains flexibility in monetary policy to address inflation, which has a bidirectional relationship with public finances. The reaction of public finances to inflation is based on Section 3 of an article that corroborates the finding that the exchange rate is dependent on industries. Additionally, the Governing Council monitors the exchange rate due to its importance to various industries, reinforcing their role in overseeing the economic impacts of inflation.",(:Governing_Council {id: e150})-[:will_maintain_in_monetary_policy]->(:flexibility {id: e5247})-[:warranted_for]->(:inflation {id: e108})-[:bidirectional_relationship]->(:public_finances {id: e9354})-[:reaction_based_on]->(:Section_3 {id: e4755})-[:section_of]->(:article {id: e1193})-[:corroborates_finding]->(:exchange_rate {id: e1616})-[:R_depend_on]->(:industries {id: e15189}),(:Governing_Council {id: e150})-[:monitors]->(:exchange_rate {id: e1616})-[:R_depend_on]->(:industries {id: e15189}),8
