Unnamed: 0,Question,Answer,Subgraph1,Subgraph2,hop_count
8,"How does the Governing Council's outlook on inflation relate to public finances, and how is this reaction reflected in Section 3 of an article that also supports findings about the exchange rate's dependence on industries?","The Governing Council's reiterated outlook on inflation affects public finances, and this reaction is based on and reflected in Section 3 of an article. This article further corroborates findings about the exchange rate's dependence on industries, which is also something the Governing Council monitors.",(:Governing_Council {id: e150})-[:reiterated_outlook]->(:inflation {id: e108})-[:affects]->(:public_finances {id: e9354})-[:reaction_based_on]->(:Section_3 {id: e4755})-[:section_of]->(:article {id: e1193})-[:corroborates_finding]->(:exchange_rate {id: e1616})-[:R_depend_on]->(:industries {id: e15189}),(:Governing_Council {id: e150})-[:monitors]->(:exchange_rate {id: e1616})-[:R_depend_on]->(:industries {id: e15189}),7
9,"How does the Governing Council's monitoring of the exchange rate relate to the industries that depend on it, according to the outlook on inflation and its impact on public finances as detailed in Section 3 of an article?","The Governing Council reiterated an outlook where an increase in inflation affects public finances. Their reaction to this is based on information presented in Section 3 of an article, which corroborates the finding that the exchange rate is significant to various industries. The Governing Council also monitors the exchange rate, recognizing its dependency on industries, indicating the intertwined nature of inflation, exchange rate, and industrial economic stability.",(:Governing_Council {id: e150})-[:reiterated_outlook]->(:inflation {id: e108})-[:increase_is]->(:inflation {id: e108})-[:affects]->(:public_finances {id: e9354})-[:reaction_based_on]->(:Section_3 {id: e4755})-[:section_of]->(:article {id: e1193})-[:corroborates_finding]->(:exchange_rate {id: e1616})-[:R_depend_on]->(:industries {id: e15189}),(:Governing_Council {id: e150})-[:monitors]->(:exchange_rate {id: e1616})-[:R_depend_on]->(:industries {id: e15189}),8
0,"How does the hospitality sector's end of VAT reduction contribute to inflation, and what type of consumer good does furniture contribute to inflation as?","The end of the VAT reduction in the hospitality sector contributes to inflation by being affected by increased oil prices, which are driven by the actions of the United States. Furniture contributes to inflation as a type of durable consumer good.",(:inflation {id: e108})-[:contribution_to_inflation_by]->(:furniture {id: e4493})-[:type_of]->(:durable_consumer_good {id: e4488}),(:inflation {id: e108})-[:contribution_to_inflation_by]->(:hospitality_sector {id: e3333})-[:affected_by_end_of]->(:VAT {id: e301})-[:increased_in_line_with]->(:oil_prices {id: e2030})-[:driven_by_action_of]->(:United_States {id: e230})-[:saw_rise_in]->(:inflation {id: e108})-[:contribution_to_inflation_by]->(:furniture {id: e4493})-[:type_of]->(:durable_consumer_good {id: e4488}),7
1,"How has the contribution of the furniture sector, as a type of durable consumer good, and the energy sector affected inflation in the context of the Euro area industrial production, specifically with relevance to supply bottlenecks in the United Kingdom?","The furniture sector, being a type of durable consumer good, has contributed to inflation along with the energy sector. The fall in activity in the energy sector led to stagnation in the Euro area industrial production, which in turn stagnated due to supply bottlenecks. These supply bottlenecks are an issue in the United Kingdom, and the UK's economy has been affected by these factors, contributing further to inflation.",(:inflation {id: e108})-[:contribution_to_inflation_by]->(:furniture {id: e4493})-[:type_of]->(:durable_consumer_good {id: e4488}),(:inflation {id: e108})-[:contribution_to_inflation_by]->(:energy_sector {id: e2258})-[:fall_in_activity_led_to_stagnation_in]->(:Euro_area_industrial_production {id: e22016})-[:stagnated_due_to]->(:supply_bottlenecks {id: e3389})-[:is_issue]->(:United_Kingdom {id: e310})-[:economy_affected_by]->(:inflation {id: e108})-[:contribution_to_inflation_by]->(:furniture {id: e4493})-[:type_of]->(:durable_consumer_good {id: e4488}),7
2,"How did the fall in activity in the energy sector contribute to the stagnation in the Euro area industrial production, and what effect did this stagnation have on inflation, considering the roles of furniture as a durable consumer good and supply bottlenecks?","The fall in activity in the energy sector led to stagnation in the Euro area industrial production. This stagnation was due to supply bottlenecks, which in turn contributed to easing price pressures. Since furniture is categorized as a type of durable consumer good, its pricing is directly influenced by inflation. Thus, the easing of price pressures could make the contribution of durable consumer goods like furniture to inflation vary.",(:inflation {id: e108})-[:contribution_to_inflation_by]->(:furniture {id: e4493})-[:type_of]->(:durable_consumer_good {id: e4488}),(:inflation {id: e108})-[:contribution_to_inflation_by]->(:energy_sector {id: e2258})-[:fall_in_activity_led_to_stagnation_in]->(:Euro_area_industrial_production {id: e22016})-[:stagnated_due_to]->(:supply_bottlenecks {id: e3389})-[:contributed_to_easing_of]->(:price_pressures {id: e3313})-[:could_make]->(:inflation {id: e108})-[:contribution_to_inflation_by]->(:furniture {id: e4493})-[:type_of]->(:durable_consumer_good {id: e4488}),7
3,"How does the furniture sector contribute to inflation, and what connection does the energy sector's fall in activity have with the stagnation of Euro area industrial production?","The furniture sector, being a type of durable consumer goods, contributes to inflation by affecting the prices of long-lasting goods that consumers purchase. The energy sector's fall in activity led to stagnation in the Euro area industrial production due to supply bottlenecks, which in turn contributed to the easing of price pressures that indicate inflation.",(:inflation {id: e108})-[:contribution_to_inflation_by]->(:furniture {id: e4493})-[:type_of]->(:durable_consumer_good {id: e4488}),(:inflation {id: e108})-[:contribution_to_inflation_by]->(:energy_sector {id: e2258})-[:fall_in_activity_led_to_stagnation_in]->(:Euro_area_industrial_production {id: e22016})-[:stagnated_due_to]->(:supply_bottlenecks {id: e3389})-[:contributed_to_easing_of]->(:price_pressures {id: e3313})-[:indicate]->(:inflation {id: e108})-[:contribution_to_inflation_by]->(:furniture {id: e4493})-[:type_of]->(:durable_consumer_good {id: e4488}),7
4,"How does the furniture sector, as a type of durable consumer good, contribute to inflation, and what impact has the fall in activity in the energy sector had on Euro area industrial production?","The furniture sector, being a type of durable consumer good, contributes to inflation by increasing the prices of such goods. Meanwhile, the fall in activity in the energy sector led to stagnation in Euro area industrial production, which was further exacerbated by supply bottlenecks that also drove up inflation.",(:inflation {id: e108})-[:contribution_to_inflation_by]->(:furniture {id: e4493})-[:type_of]->(:durable_consumer_good {id: e4488}),(:inflation {id: e108})-[:contribution_to_inflation_by]->(:energy_sector {id: e2258})-[:fall_in_activity_led_to_stagnation_in]->(:Euro_area_industrial_production {id: e22016})-[:stagnated_due_to]->(:supply_bottlenecks {id: e3389})-[:driven]->(:inflation {id: e108})-[:contribution_to_inflation_by]->(:furniture {id: e4493})-[:type_of]->(:durable_consumer_good {id: e4488}),6
5,"How does the furniture sector, as a type of durable consumer good, contribute to inflation, and what role does the energy sector's fall in activity, leading to stagnation in Euro area industrial production due to supply bottlenecks, have in driving inflation?","The furniture sector contributes to inflation as it is a type of durable consumer good which is factored into inflation calculations. At the same time, a fall in activity in the energy sector has led to stagnation in Euro area industrial production, primarily due to supply bottlenecks. This stagnation indirectly drives inflation, as supply constraints can lead to higher prices for industrial products, including durable goods like furniture.",(:inflation {id: e108})-[:contribution_to_inflation_by]->(:furniture {id: e4493})-[:type_of]->(:durable_consumer_good {id: e4488}),(:inflation {id: e108})-[:contribution_to_inflation_by]->(:energy_sector {id: e2258})-[:fall_in_activity_led_to_stagnation_in]->(:Euro_area_industrial_production {id: e22016})-[:stagnated_due_to]->(:supply_bottlenecks {id: e3389})-[:driven]->(:inflation {id: e108})-[:increase_is]->(:inflation {id: e108})-[:contribution_to_inflation_by]->(:furniture {id: e4493})-[:type_of]->(:durable_consumer_good {id: e4488}),7
6,How has the energy sector's fall in activity contributed to inflation and its relation to stagnation in the Euro area industrial production?,"The fall in activity in the energy sector contributed to inflation by leading to stagnation in the Euro area industrial production, which was stagnated due to supply bottlenecks that, in turn, drove inflation higher.",(:inflation {id: e108})-[:contribution_to_inflation_by]->(:furniture {id: e4493})-[:type_of]->(:durable_consumer_good {id: e4488}),(:inflation {id: e108})-[:contribution_to_inflation_by]->(:energy_sector {id: e2258})-[:fall_in_activity_led_to_stagnation_in]->(:Euro_area_industrial_production {id: e22016})-[:stagnated_due_to]->(:supply_bottlenecks {id: e3389})-[:driven]->(:inflation {id: e108})-[:increased]->(:inflation {id: e108})-[:contribution_to_inflation_by]->(:furniture {id: e4493})-[:type_of]->(:durable_consumer_good {id: e4488}),7
7,"How has the performance of the energy sector and the furniture sector as a durable consumer good contributed to inflation, and what impact did a fall in the energy sector's activity have on Euro area industrial production?","Both the energy sector and the furniture sector, which is considered a type of durable consumer good, have contributed to inflation. Additionally, a fall in the energy sector's activity led to stagnation in the Euro area industrial production. This stagnation was subsequently caused by supply bottlenecks, which are a driver of economic activity. As economic activity recovers, it is amid conditions of inflation to which these sectors have contributed.",(:inflation {id: e108})-[:contribution_to_inflation_by]->(:furniture {id: e4493})-[:type_of]->(:durable_consumer_good {id: e4488}),(:inflation {id: e108})-[:contribution_to_inflation_by]->(:energy_sector {id: e2258})-[:fall_in_activity_led_to_stagnation_in]->(:Euro_area_industrial_production {id: e22016})-[:stagnated_due_to]->(:supply_bottlenecks {id: e3389})-[:driver_of]->(:economic_activity {id: e1381})-[:recovers_amid]->(:inflation {id: e108})-[:contribution_to_inflation_by]->(:furniture {id: e4493})-[:type_of]->(:durable_consumer_good {id: e4488}),7
8,"How has the fall in activity in the energy sector contributed to stagnation in the Euro area industrial production, and how is this stagnation connected to the efforts of firms to stabilize profits, ultimately contributing to inflation, of which furniture as a durable consumer good is also a part?","The fall in activity in the energy sector has led to stagnation in the Euro area industrial production due to supply bottlenecks. These supply bottlenecks have, in turn, enabled firms to try to stabilize profits in the face of these production challenges. This effort by firms to maintain profitability has contributed to inflation. Furniture, which is categorized as a type of durable consumer good, also contributes to inflation.",(:inflation {id: e108})-[:contribution_to_inflation_by]->(:furniture {id: e4493})-[:type_of]->(:durable_consumer_good {id: e4488}),(:inflation {id: e108})-[:contribution_to_inflation_by]->(:energy_sector {id: e2258})-[:fall_in_activity_led_to_stagnation_in]->(:Euro_area_industrial_production {id: e22016})-[:stagnated_due_to]->(:supply_bottlenecks {id: e3389})-[:enables]->(:firms {id: e232})-[:try_to_stabilise_profits]->(:inflation {id: e108})-[:contribution_to_inflation_by]->(:furniture {id: e4493})-[:type_of]->(:durable_consumer_good {id: e4488}),7
9,"How does the furniture sector contribute to inflation, and what has led to the stagnation in Euro area industrial production, which is also a risk to inflation?","The furniture sector contributes to inflation as a type of durable consumer good. The fall in activity in the energy sector has led to stagnation in the Euro area industrial production, which has stagnated due to supply bottlenecks. These supply bottlenecks present a risk to inflation.",(:inflation {id: e108})-[:contribution_to_inflation_by]->(:furniture {id: e4493})-[:type_of]->(:durable_consumer_good {id: e4488}),(:inflation {id: e108})-[:contribution_to_inflation_by]->(:energy_sector {id: e2258})-[:fall_in_activity_led_to_stagnation_in]->(:Euro_area_industrial_production {id: e22016})-[:stagnated_due_to]->(:supply_bottlenecks {id: e3389})-[:is_a_risk_to]->(:inflation {id: e108})-[:contribution_to_inflation_by]->(:furniture {id: e4493})-[:type_of]->(:durable_consumer_good {id: e4488}),6
0,"How has the pandemic highlighted the need for flexibility in asset purchases, and which sector reported the highest importance for support in wage bills due to more deteriorated profit sentiment, leading to inflation in the euro area countries as a result of supply disruptions?","The pandemic has shown the need for flexibility in asset purchases, which exert stronger effects in the euro area countries. This situation led to a rise in inflation due to supply disruptions caused by the pandemic. Meanwhile, the services sector, which experienced a more deteriorated profit sentiment as a result of the pandemic, reported the highest importance for support in wage bills.",(:pandemic {id: e1589})-[:sector_with_more_deteriorated_profit_sentiment]->(:services_sector {id: e1595})-[:reported_highest_importance_for_support_in]->(:wage_bills {id: e19091}),(:pandemic {id: e1589})-[:shown_the_need_for_flexibility_in]->(:asset_purchases {id: e3294})-[:exert_stronger_effects_in]->(:euro_area_countries {id: e481})-[:saw_rise_in]->(:inflation {id: e108})-[:decline_due_to]->(:supply_disruptions {id: e3929})-[:caused_by]->(:pandemic {id: e1589})-[:sector_with_more_deteriorated_profit_sentiment]->(:services_sector {id: e1595})-[:reported_highest_importance_for_support_in]->(:wage_bills {id: e19091}),7
1,"How has the pandemic highlighted the need for flexibility in asset purchases and what economic effects have been stronger in the euro area countries as a result, in relation to the services sector's concerns during the pandemic?","The pandemic has shown the need for flexibility in asset purchases and these adjustments have exerted stronger effects in euro area countries, leading to a rise in inflation, which can be attributed to supply disruptions related to the pandemic. Concurrently, the services sector, which experienced a more deteriorated profit sentiment due to the pandemic, reported that wage bills were of the highest importance for support.",(:pandemic {id: e1589})-[:sector_with_more_deteriorated_profit_sentiment]->(:services_sector {id: e1595})-[:reported_highest_importance_for_support_in]->(:wage_bills {id: e19091}),(:pandemic {id: e1589})-[:shown_the_need_for_flexibility_in]->(:asset_purchases {id: e3294})-[:exert_stronger_effects_in]->(:euro_area_countries {id: e481})-[:saw_rise_in]->(:inflation {id: e108})-[:decline_due_to]->(:supply_disruptions {id: e3929})-[:related_to]->(:pandemic {id: e1589})-[:sector_with_more_deteriorated_profit_sentiment]->(:services_sector {id: e1595})-[:reported_highest_importance_for_support_in]->(:wage_bills {id: e19091}),7
2,"How has the pandemic highlighted the need for support in wage bills within the services sector, and what economic consequences have European countries faced, particularly regarding inflation and monetary policy?","The pandemic has led to a more deteriorated profit sentiment within the services sector, which reported the highest importance for support in wage bills. Moreover, it has shown the need for flexibility in asset purchases, which have exerted stronger effects in euro area countries. These countries saw a rise in inflation, which experienced a decline due to monetary policy. However, this policy has had an impaired transmission impact due to the pandemic.",(:pandemic {id: e1589})-[:sector_with_more_deteriorated_profit_sentiment]->(:services_sector {id: e1595})-[:reported_highest_importance_for_support_in]->(:wage_bills {id: e19091}),(:pandemic {id: e1589})-[:shown_the_need_for_flexibility_in]->(:asset_purchases {id: e3294})-[:exert_stronger_effects_in]->(:euro_area_countries {id: e481})-[:saw_rise_in]->(:inflation {id: e108})-[:decline_due_to]->(:monetary_policy {id: e1227})-[:has_impaired_transmission_impact_from]->(:pandemic {id: e1589})-[:sector_with_more_deteriorated_profit_sentiment]->(:services_sector {id: e1595})-[:reported_highest_importance_for_support_in]->(:wage_bills {id: e19091}),7
3,"During the pandemic, which sector reported the highest importance for support in wage bills, and how has this context shown the need for flexibility in asset purchases, particularly in the euro area countries that saw a rise in inflation, which eventually experienced a decline due to monetary policy?","During the pandemic, the services sector reported the highest importance for support in wage bills. This situation highlighted the need for flexibility in asset purchases, especially in the euro area countries, where there was a rise in inflation that subsequently saw a decline due to the responsive monetary policy.",(:pandemic {id: e1589})-[:sector_with_more_deteriorated_profit_sentiment]->(:services_sector {id: e1595})-[:reported_highest_importance_for_support_in]->(:wage_bills {id: e19091}),(:pandemic {id: e1589})-[:shown_the_need_for_flexibility_in]->(:asset_purchases {id: e3294})-[:exert_stronger_effects_in]->(:euro_area_countries {id: e481})-[:saw_rise_in]->(:inflation {id: e108})-[:decline_due_to]->(:monetary_policy {id: e1227})-[:responds_to]->(:pandemic {id: e1589})-[:sector_with_more_deteriorated_profit_sentiment]->(:services_sector {id: e1595})-[:reported_highest_importance_for_support_in]->(:wage_bills {id: e19091}),7
4,"During the pandemic, which sector reported the highest importance for support in wage bills, and how did the pandemic show the need for flexibility in a particular financial strategy, which in turn exerted stronger effects in a specific region that saw a rise in inflation?","During the pandemic, the services sector reported the highest importance for support in wage bills. The pandemic showed the need for flexibility in asset purchases, which exerted stronger effects in the Euro area countries. This region saw a rise in inflation.",(:pandemic {id: e1589})-[:sector_with_more_deteriorated_profit_sentiment]->(:services_sector {id: e1595})-[:reported_highest_importance_for_support_in]->(:wage_bills {id: e19091}),(:pandemic {id: e1589})-[:shown_the_need_for_flexibility_in]->(:asset_purchases {id: e3294})-[:exert_stronger_effects_in]->(:euro_area_countries {id: e481})-[:saw_rise_in]->(:inflation {id: e108})-[:risk_direction]->(:Governing_Council {id: e150})-[:aiming_to_counter_risks_related_to]->(:pandemic {id: e1589})-[:sector_with_more_deteriorated_profit_sentiment]->(:services_sector {id: e1595})-[:reported_highest_importance_for_support_in]->(:wage_bills {id: e19091}),7
5,"How has the pandemic highlighted the importance of flexibility in asset purchases, and what sector reported the highest importance for support in wage bills due to more deteriorated profit sentiment?","The pandemic has shown the need for flexibility in asset purchases, which exert stronger effects in euro area countries and have led to a rise in inflation, a primary risk that the Governing Council is aiming to counter. Additionally, the services sector, which suffered from more deteriorated profit sentiment due to the pandemic, reported the highest importance for support in wage bills.",(:pandemic {id: e1589})-[:sector_with_more_deteriorated_profit_sentiment]->(:services_sector {id: e1595})-[:reported_highest_importance_for_support_in]->(:wage_bills {id: e19091}),(:pandemic {id: e1589})-[:shown_the_need_for_flexibility_in]->(:asset_purchases {id: e3294})-[:exert_stronger_effects_in]->(:euro_area_countries {id: e481})-[:saw_rise_in]->(:inflation {id: e108})-[:primary_risks]->(:Governing_Council {id: e150})-[:aiming_to_counter_risks_related_to]->(:pandemic {id: e1589})-[:sector_with_more_deteriorated_profit_sentiment]->(:services_sector {id: e1595})-[:reported_highest_importance_for_support_in]->(:wage_bills {id: e19091}),7
6,"During the pandemic, which sector reported the highest importance for support in wage bills, and how did this event demonstrate the need for flexibility in asset purchases, particularly in relation to the euro area countries' experience with inflation?","During the pandemic, the services sector reported the highest importance for support in wage bills. This situation demonstrated the need for flexibility in asset purchases as asset purchases exert stronger effects in euro area countries, which saw a rise in inflation. Inflation increased across advanced economies as the economies began to recover after the pandemic.",(:pandemic {id: e1589})-[:sector_with_more_deteriorated_profit_sentiment]->(:services_sector {id: e1595})-[:reported_highest_importance_for_support_in]->(:wage_bills {id: e19091}),(:pandemic {id: e1589})-[:shown_the_need_for_flexibility_in]->(:asset_purchases {id: e3294})-[:exert_stronger_effects_in]->(:euro_area_countries {id: e481})-[:saw_rise_in]->(:inflation {id: e108})-[:increased_across]->(:advanced_economies {id: e5328})-[:recovers_after]->(:pandemic {id: e1589})-[:sector_with_more_deteriorated_profit_sentiment]->(:services_sector {id: e1595})-[:reported_highest_importance_for_support_in]->(:wage_bills {id: e19091}),7
7,"During the pandemic, which sector reported the highest importance for support in wage bills and also saw more deteriorated profit sentiment, and which economic region experienced inflation that the Governing Council aimed to counter risks associated with through asset purchase flexibility?","During the pandemic, the services sector reported the highest importance for support in wage bills and also saw more deteriorated profit sentiment. The euro area countries experienced inflation that the Governing Council aimed to counter risks associated with through increased flexibility in asset purchases.",(:pandemic {id: e1589})-[:sector_with_more_deteriorated_profit_sentiment]->(:services_sector {id: e1595})-[:reported_highest_importance_for_support_in]->(:wage_bills {id: e19091}),(:pandemic {id: e1589})-[:shown_the_need_for_flexibility_in]->(:asset_purchases {id: e3294})-[:exert_stronger_effects_in]->(:euro_area_countries {id: e481})-[:saw_rise_in]->(:inflation {id: e108})-[:moves_towards]->(:Governing_Council {id: e150})-[:aiming_to_counter_risks_related_to]->(:pandemic {id: e1589})-[:sector_with_more_deteriorated_profit_sentiment]->(:services_sector {id: e1595})-[:reported_highest_importance_for_support_in]->(:wage_bills {id: e19091}),7
8,"How did the pandemic highlight the need for flexibility in asset purchases, and what was the effect of this in the euro area, and which sector reported the highest importance for support in wage bills?","The pandemic showed the need for flexibility in asset purchases which exerted stronger effects in euro area countries, leading to a rise in inflation over the medium term. Additionally, the services sector, which experienced a more deteriorated profit sentiment due to the pandemic, reported the highest importance for support in wage bills.",(:pandemic {id: e1589})-[:sector_with_more_deteriorated_profit_sentiment]->(:services_sector {id: e1595})-[:reported_highest_importance_for_support_in]->(:wage_bills {id: e19091}),(:pandemic {id: e1589})-[:shown_the_need_for_flexibility_in]->(:asset_purchases {id: e3294})-[:exert_stronger_effects_in]->(:euro_area_countries {id: e481})-[:saw_rise_in]->(:inflation {id: e108})-[:occur_over]->(:medium_term {id: e171})-[:after_impact]->(:pandemic {id: e1589})-[:sector_with_more_deteriorated_profit_sentiment]->(:services_sector {id: e1595})-[:reported_highest_importance_for_support_in]->(:wage_bills {id: e19091}),7
9,"Which sector reported the highest importance for support in wage bills during the pandemic, and how did the pandemic show the need for flexibility in a certain type of economic activity in the euro area that led to a rise in inflation expected to change over the medium term?","The services sector reported the highest importance for support in wage bills during the pandemic. The pandemic showed the need for flexibility in asset purchases, which had stronger effects in euro area countries, leading to a rise in inflation that is expected to change over the medium term.",(:pandemic {id: e1589})-[:sector_with_more_deteriorated_profit_sentiment]->(:services_sector {id: e1595})-[:reported_highest_importance_for_support_in]->(:wage_bills {id: e19091}),(:pandemic {id: e1589})-[:shown_the_need_for_flexibility_in]->(:asset_purchases {id: e3294})-[:exert_stronger_effects_in]->(:euro_area_countries {id: e481})-[:saw_rise_in]->(:inflation {id: e108})-[:expected_change_over]->(:medium_term {id: e171})-[:after_impact]->(:pandemic {id: e1589})-[:sector_with_more_deteriorated_profit_sentiment]->(:services_sector {id: e1595})-[:reported_highest_importance_for_support_in]->(:wage_bills {id: e19091}),7
