Unnamed: 0,Question,Answer,Subgraph1,Subgraph2,hop_count
0,How has the growth momentum described in advanced economies impacted the global goods trade and what effect has the pandemic had on the profit sentiment in the services sector within these economies?,"The growth momentum described in advanced economies has become less negative in the global goods trade, indicating an improvement. However, within these advanced economies, the pandemic has led to a more deteriorated profit sentiment in the services sector.",(:advanced_economies {id: e5328})-[:describes_momentum_as]->(:growth_momentum {id: e1724})-[:become_less_negative_in]->(:global_goods_trade {id: e21272}),(:advanced_economies {id: e5328})-[:is_experiencing]->(:vaccinations {id: e18659})-[:promises_containment_of]->(:pandemic {id: e1589})-[:sector_with_more_deteriorated_profit_sentiment]->(:services_sector {id: e1595})-[:reported]->(:growth_momentum {id: e1724})-[:described_in]->(:advanced_economies {id: e5328})-[:describes_momentum_as]->(:growth_momentum {id: e1724})-[:become_less_negative_in]->(:global_goods_trade {id: e21272}),7
1,"How has the improvement in growth momentum in advanced economies influenced global goods trade, and what role has the successful vaccination campaign had on the sectors within these economies?","The improvement in growth momentum described in advanced economies has led to less negative impacts on global goods trade, signaling a recovery or a rebound in international commercial activities. Concurrently, the successful vaccinations in these advanced economies have promised containment of the pandemic, which has led to the reopening of various sectors. This reopening, in turn, has faced issues with financial conditions, although these conditions remain supportive in advanced economies, facilitating continued economic recovery and growth.",(:advanced_economies {id: e5328})-[:describes_momentum_as]->(:growth_momentum {id: e1724})-[:become_less_negative_in]->(:global_goods_trade {id: e21272}),(:advanced_economies {id: e5328})-[:is_experiencing]->(:vaccinations {id: e18659})-[:promises_containment_of]->(:pandemic {id: e1589})-[:leads_to_reopening_of]->(:sectors {id: e224})-[:faced_issue]->(:financial_conditions {id: e173})-[:remain_supportive_in]->(:advanced_economies {id: e5328})-[:describes_momentum_as]->(:growth_momentum {id: e1724})-[:become_less_negative_in]->(:global_goods_trade {id: e21272}),7
2,"How has the growth momentum in advanced economies impacted global goods trade, and what has contributed to the containment of pandemic-related downside risks in these economies?","The growth momentum in advanced economies has become less negative in global goods trade, indicating an improvement or stabilization in trade conditions. Additionally, the rollout of vaccinations in advanced economies promises containment of the pandemic, which in turn declines the risk for downside risks associated with the pandemic in these regions.",(:advanced_economies {id: e5328})-[:describes_momentum_as]->(:growth_momentum {id: e1724})-[:become_less_negative_in]->(:global_goods_trade {id: e21272}),(:advanced_economies {id: e5328})-[:is_experiencing]->(:vaccinations {id: e18659})-[:promises_containment_of]->(:pandemic {id: e1589})-[:declines_risk_for]->(:downside_risks {id: e1625})-[:due_to]->(:pandemic {id: e1589})-[:in]->(:advanced_economies {id: e5328})-[:describes_momentum_as]->(:growth_momentum {id: e1724})-[:become_less_negative_in]->(:global_goods_trade {id: e21272}),7
3,"How has the growth momentum in advanced economies influenced the global goods trade during the pandemic, and what has been the role of vaccinations in these advanced economies?","The growth momentum described in advanced economies has led to the global goods trade becoming less negative during the pandemic. Additionally, the advanced economies have been experiencing vaccinations that promise the containment of the pandemic. This containment allows households to draw on savings that were built up during the pandemic, positively impacting the growth momentum and, consequently, the global goods trade.",(:advanced_economies {id: e5328})-[:describes_momentum_as]->(:growth_momentum {id: e1724})-[:become_less_negative_in]->(:global_goods_trade {id: e21272}),(:advanced_economies {id: e5328})-[:is_experiencing]->(:vaccinations {id: e18659})-[:promises_containment_of]->(:pandemic {id: e1589})-[:allows_households_to_draw_on]->(:savings {id: e5506})-[:built_up_during]->(:pandemic {id: e1589})-[:in]->(:advanced_economies {id: e5328})-[:describes_momentum_as]->(:growth_momentum {id: e1724})-[:become_less_negative_in]->(:global_goods_trade {id: e21272}),7
4,"How has the momentum of growth in advanced economies impacted global goods trade during the pandemic, and what role has the vaccine rollout played in this context?","The growth momentum in advanced economies has become less negative in the context of global goods trade during the pandemic. This improvement in trade dynamics can be attributed to the successful rollout of vaccinations in these economies, which promises containment of the pandemic. As the pandemic is contained, households are able to draw on savings that were accumulated during the pandemic, further bolstering the economic momentum in advanced economies and, by extension, positively impacting global goods trade.",(:advanced_economies {id: e5328})-[:describes_momentum_as]->(:growth_momentum {id: e1724})-[:become_less_negative_in]->(:global_goods_trade {id: e21272}),(:advanced_economies {id: e5328})-[:is_experiencing]->(:vaccinations {id: e18659})-[:promises_containment_of]->(:pandemic {id: e1589})-[:allows_households_to_draw_on]->(:savings {id: e5506})-[:accumulated_during]->(:pandemic {id: e1589})-[:in]->(:advanced_economies {id: e5328})-[:describes_momentum_as]->(:growth_momentum {id: e1724})-[:become_less_negative_in]->(:global_goods_trade {id: e21272}),7
5,"How has the growth momentum described by advanced economies impacted global goods trade, and what has been the role of vaccinations in the containment of the pandemic in the context of policy measures implemented by the ECB?","The growth momentum described by advanced economies has become less negative in the context of global goods trade, signaling a potential improvement. Concurrently, advanced economies experiencing an increase in vaccinations promise the containment of the pandemic, which is crucial for the policy measures implemented by the European Central Bank (ECB) to be effective in these economies.",(:advanced_economies {id: e5328})-[:describes_momentum_as]->(:growth_momentum {id: e1724})-[:become_less_negative_in]->(:global_goods_trade {id: e21272}),(:advanced_economies {id: e5328})-[:is_experiencing]->(:vaccinations {id: e18659})-[:promises_containment_of]->(:pandemic {id: e1589})-[:context_for]->(:policy_measures {id: e2828})-[:implemented_by]->(:ECB {id: e849})-[:decline_observed_in]->(:advanced_economies {id: e5328})-[:describes_momentum_as]->(:growth_momentum {id: e1724})-[:become_less_negative_in]->(:global_goods_trade {id: e21272}),7
6,How does the growth momentum in advanced economies relate to the global goods trade and the containment of the pandemic?,"The growth momentum in advanced economies has become less negative in the context of global goods trade, suggesting a potential recovery or improvement in the trade of goods. Furthermore, advanced economies are experiencing vaccinations that promise containment of the pandemic, which affects the pace of recovery. The recovery from the pandemic is hampered in these economies, but the efforts to manage the pandemic through vaccinations can positively influence both the economic momentum and the recovery process, ultimately benefitting the global goods trade.",(:advanced_economies {id: e5328})-[:describes_momentum_as]->(:growth_momentum {id: e1724})-[:become_less_negative_in]->(:global_goods_trade {id: e21272}),(:advanced_economies {id: e5328})-[:is_experiencing]->(:vaccinations {id: e18659})-[:promises_containment_of]->(:pandemic {id: e1589})-[:affects_pace_of_recovery]->(:recovery {id: e1505})-[:hampered_by]->(:pandemic {id: e1589})-[:in]->(:advanced_economies {id: e5328})-[:describes_momentum_as]->(:growth_momentum {id: e1724})-[:become_less_negative_in]->(:global_goods_trade {id: e21272}),7
7,"How has the growth momentum in advanced economies impacted the global goods trade, and what role has the vaccination rollout played in influencing the economic outlook of these regions?","The growth momentum described in advanced economies has become less negative in relation to the global goods trade, indicating an improvement or recovery in trading activities. Additionally, these advanced economies are experiencing widespread vaccinations, which promises containment of the pandemic. This containment of the pandemic is contributing to a decline in risk relating to the economic outlook, driven predominantly by the vaccination campaigns rolled out in these advanced economies. Therefore, the vaccination efforts have played a crucial role in bolstering the growth momentum and improving the economic prospects, thus positively influencing the global goods trade.",(:advanced_economies {id: e5328})-[:describes_momentum_as]->(:growth_momentum {id: e1724})-[:become_less_negative_in]->(:global_goods_trade {id: e21272}),(:advanced_economies {id: e5328})-[:is_experiencing]->(:vaccinations {id: e18659})-[:promises_containment_of]->(:pandemic {id: e1589})-[:decline_in_risk_relating_to]->(:economic_outlook {id: e3409})-[:driven_by]->(:vaccination_campaigns {id: e1585})-[:rolled_out_in]->(:advanced_economies {id: e5328})-[:describes_momentum_as]->(:growth_momentum {id: e1724})-[:become_less_negative_in]->(:global_goods_trade {id: e21272}),7
8,"How has the rollout of vaccinations in advanced economies influenced their economic outlook, particularly in terms of growth momentum and global goods trade?","In advanced economies, the rollout of vaccinations promises containment of the pandemic, which in turn has led to a decline in risk relating to the economic outlook. This improved outlook is reflected by a less negative growth momentum in these economies, which has also positively impacted global goods trade.",(:advanced_economies {id: e5328})-[:describes_momentum_as]->(:growth_momentum {id: e1724})-[:become_less_negative_in]->(:global_goods_trade {id: e21272}),(:advanced_economies {id: e5328})-[:is_experiencing]->(:vaccinations {id: e18659})-[:promises_containment_of]->(:pandemic {id: e1589})-[:decline_in_risk_relating_to]->(:economic_outlook {id: e3409})-[:affected_by]->(:pandemic {id: e1589})-[:in]->(:advanced_economies {id: e5328})-[:describes_momentum_as]->(:growth_momentum {id: e1724})-[:become_less_negative_in]->(:global_goods_trade {id: e21272}),7
9,"How has the momentum of growth in advanced economies been affected by the pandemic, considering the impact on global goods trade and monetary policy?","The growth momentum in advanced economies, which has been described as becoming less negative, has seen an impact on global goods trade where the negative impacts have started to lessen. Additionally, the pandemic has impaired the transmission impact of monetary policy in these economies. However, advanced economies are experiencing vaccinations that promise containment of the pandemic, which could further influence both the growth momentum and the effectiveness of monetary policy.",(:advanced_economies {id: e5328})-[:describes_momentum_as]->(:growth_momentum {id: e1724})-[:become_less_negative_in]->(:global_goods_trade {id: e21272}),(:advanced_economies {id: e5328})-[:is_experiencing]->(:vaccinations {id: e18659})-[:promises_containment_of]->(:pandemic {id: e1589})-[:revealed_about]->(:monetary_policy {id: e1227})-[:has_impaired_transmission_impact_from]->(:pandemic {id: e1589})-[:in]->(:advanced_economies {id: e5328})-[:describes_momentum_as]->(:growth_momentum {id: e1724})-[:become_less_negative_in]->(:global_goods_trade {id: e21272}),7
0,"What is being discussed concerning China's real GDP growth in relation to Turkey, and how did it affect Turkey's employment growth and domestic demand?","China's real GDP growth is being discussed concerning its outlook in Turkey. The region's recovery has been linked to the fourth quarter of 2019 in terms of employment growth, which is associated with domestic demand that is currently slowing in Turkey.",(:China {id: e207})-[:is_being_discussed_concerning]->(:real_GDP_growth {id: e3611})-[:outlook_for_in]->(:Turkey {id: e550}),(:China {id: e207})-[:is_being_discussed_concerning]->(:real_GDP_growth {id: e3611})-[:outlook_for_in]->(:Turkey {id: e550})-[:region_recovered_to]->(:fourth_quarter_of_2019 {id: e538})-[:TimeOf]->(:employment_growth {id: e3095})-[:AssociatedWith]->(:domestic_demand {id: e1894})-[:is_slowing_in]->(:Turkey {id: e550}),6
1,"What is the concern being discussed about China's real GDP growth in relation to Turkey, and what is causing turmoil in Turkey's economy?","The concern being discussed about China's real GDP growth is in relation to Turkey's economic outlook. Turkey is facing turmoil due to inflation, which is affected by rising food prices. This inflation has been occurring due to domestic demand that is slowing in Turkey.",(:China {id: e207})-[:is_being_discussed_concerning]->(:real_GDP_growth {id: e3611})-[:outlook_for_in]->(:Turkey {id: e550}),(:China {id: e207})-[:is_being_discussed_concerning]->(:real_GDP_growth {id: e3611})-[:outlook_for_in]->(:Turkey {id: e550})-[:turmoil_due_to]->(:inflation {id: e108})-[:affected_by]->(:food_prices {id: e2758})-[:Due_to]->(:domestic_demand {id: e1894})-[:is_slowing_in]->(:Turkey {id: e550}),6
2,How is the discussion of China's real GDP growth related to the economic outlook of Turkey and what specific issue is causing turmoil due to inflation in Turkey?,"The discussion concerning China's real GDP growth involves the economic outlook for Turkey, where there is turmoil due to inflation. This inflation is specifically caused by rising food prices, which in turn is due to slowing domestic demand in Turkey.",(:China {id: e207})-[:is_being_discussed_concerning]->(:real_GDP_growth {id: e3611})-[:outlook_for_in]->(:Turkey {id: e550}),(:China {id: e207})-[:is_being_discussed_concerning]->(:real_GDP_growth {id: e3611})-[:outlook_for_in]->(:Turkey {id: e550})-[:turmoil_due_to]->(:inflation {id: e108})-[:caused_by]->(:food_prices {id: e2758})-[:Due_to]->(:domestic_demand {id: e1894})-[:is_slowing_in]->(:Turkey {id: e550}),6
3,"How is the real GDP growth of China being discussed in relation to Turkey's economy, specifically in the context of inflation and its causes?","The real GDP growth of China is being discussed concerning its outlook for Turkey, where there is turmoil due to inflation. This inflation in Turkey is caused by slowing domestic demand.",(:China {id: e207})-[:is_being_discussed_concerning]->(:real_GDP_growth {id: e3611})-[:outlook_for_in]->(:Turkey {id: e550}),(:China {id: e207})-[:is_being_discussed_concerning]->(:real_GDP_growth {id: e3611})-[:outlook_for_in]->(:Turkey {id: e550})-[:turmoil_due_to]->(:inflation {id: e108})-[:caused_by]->(:domestic_demand {id: e1894})-[:is_slowing_in]->(:Turkey {id: e550}),5
4,"How is China's real GDP growth being discussed in relation to its outlook for Turkey, especially considering Turkey's economic turmoil due to inflation which is increased by slowing domestic demand?","China's real GDP growth is being discussed in the context of its outlook for Turkey, where the economic situation is experiencing turmoil due to inflation. This inflation in Turkey is attributed to a decrease in domestic demand, which is slowing down in the country.",(:China {id: e207})-[:is_being_discussed_concerning]->(:real_GDP_growth {id: e3611})-[:outlook_for_in]->(:Turkey {id: e550}),(:China {id: e207})-[:is_being_discussed_concerning]->(:real_GDP_growth {id: e3611})-[:outlook_for_in]->(:Turkey {id: e550})-[:turmoil_due_to]->(:inflation {id: e108})-[:increase_is]->(:inflation {id: e108})-[:caused_by]->(:domestic_demand {id: e1894})-[:is_slowing_in]->(:Turkey {id: e550}),6
5,How is China's concern over real GDP growth related to the economic outlook for Turkey and how does Turkey's inflation potentially influence the euro area's economic recovery?,"China's concern regarding its real GDP growth is related to the economic outlook for Turkey, as they appear to be discussing the impacts of China's growth on Turkey's economy. Additionally, Turkey is facing turmoil due to inflation, which is influencing the euro area economy. However, the recovery in the euro area is supported by domestic demand, which is concurrently slowing in Turkey.",(:China {id: e207})-[:is_being_discussed_concerning]->(:real_GDP_growth {id: e3611})-[:outlook_for_in]->(:Turkey {id: e550}),(:China {id: e207})-[:is_being_discussed_concerning]->(:real_GDP_growth {id: e3611})-[:outlook_for_in]->(:Turkey {id: e550})-[:turmoil_due_to]->(:inflation {id: e108})-[:influence]->(:euro_area_economy {id: e1548})-[:recovery_supported_by]->(:domestic_demand {id: e1894})-[:is_slowing_in]->(:Turkey {id: e550}),6
6,"What is the reason for the economic turmoil in Turkey as discussed in the context of China's real GDP growth, and what factor is contributing to this situation?","The economic turmoil in Turkey, as discussed in the context of China's real GDP growth, is due to increased inflation. Additionally, this inflation has been caused by slowing domestic demand within Turkey.",(:China {id: e207})-[:is_being_discussed_concerning]->(:real_GDP_growth {id: e3611})-[:outlook_for_in]->(:Turkey {id: e550}),(:China {id: e207})-[:is_being_discussed_concerning]->(:real_GDP_growth {id: e3611})-[:outlook_for_in]->(:Turkey {id: e550})-[:turmoil_due_to]->(:inflation {id: e108})-[:increased]->(:inflation {id: e108})-[:caused_by]->(:domestic_demand {id: e1894})-[:is_slowing_in]->(:Turkey {id: e550}),6
7,"What is being discussed in regards to China's real GDP growth's impact on Turkey, particularly in relation to the recovery of a certain economic region to the levels of the fourth quarter of 2019 and its association with employment growth and domestic demand?","The discussion concerning China's real GDP growth revolves around its impact on Turkey, where it is projected that the region Turkey has recovered to the levels seen in the fourth quarter of 2019 in terms of employment growth, which is associated with domestic demand. However, it is noted that domestic demand in Turkey is slowing down.",(:China {id: e207})-[:is_being_discussed_concerning]->(:real_GDP_growth {id: e3611})-[:outlook_for_in]->(:Turkey {id: e550}),(:China {id: e207})-[:is_being_discussed_concerning]->(:real_GDP_growth {id: e3611})-[:will_be]->(:Turkey {id: e550})-[:region_recovered_to]->(:fourth_quarter_of_2019 {id: e538})-[:TimeOf]->(:employment_growth {id: e3095})-[:AssociatedWith]->(:domestic_demand {id: e1894})-[:is_slowing_in]->(:Turkey {id: e550}),7
8,"What is being discussed concerning China's real GDP growth in relation to Turkey, and what economic issue in Turkey is affecting this outlook?","China's real GDP growth is being discussed concerning its outlook in Turkey, where there is turmoil due to inflation, which is being affected by food prices due to slowing domestic demand.",(:China {id: e207})-[:is_being_discussed_concerning]->(:real_GDP_growth {id: e3611})-[:outlook_for_in]->(:Turkey {id: e550}),(:China {id: e207})-[:is_being_discussed_concerning]->(:real_GDP_growth {id: e3611})-[:will_be]->(:Turkey {id: e550})-[:turmoil_due_to]->(:inflation {id: e108})-[:affected_by]->(:food_prices {id: e2758})-[:Due_to]->(:domestic_demand {id: e1894})-[:is_slowing_in]->(:Turkey {id: e550}),7
9,How is China's real GDP growth being discussed in relation to Turkey's economic outlook and the factors causing turmoil in its economy?,"China's real GDP growth is being discussed concerning its impact on Turkey's economic outlook, where Turkey is experiencing turmoil due to inflation caused by slowing domestic demand.",(:China {id: e207})-[:is_being_discussed_concerning]->(:real_GDP_growth {id: e3611})-[:outlook_for_in]->(:Turkey {id: e550}),(:China {id: e207})-[:is_being_discussed_concerning]->(:real_GDP_growth {id: e3611})-[:will_be]->(:Turkey {id: e550})-[:turmoil_due_to]->(:inflation {id: e108})-[:caused_by]->(:domestic_demand {id: e1894})-[:is_slowing_in]->(:Turkey {id: e550}),6
0,"Did the euro area reach its pre-pandemic economic level after a decline, and if so, how did this recovery relate to the level of permanent migrants and the unemployment rate in the same period?","Yes, the euro area reached its pre-pandemic economic level after experiencing a decline. This recovery occurred above the level of permanent migrants associated with the decline in 2020. Despite this recovery, the unemployment rate in the euro area remained broadly unchanged and still exceeds the pre-pandemic level.",(:euro_area {id: e375})-[:reached]->(:pre_pandemic_level {id: e3321})-[:after_decline]->(:decline {id: e2038}),(:euro_area {id: e375})-[:reached]->(:pre_pandemic_level {id: e3321})-[:above]->(:_2020 {id: e520})-[:associated_with_decline]->(:permanent_migrants {id: e4171})-[:decline_common_to]->(:euro_area {id: e375})-[:broadly_unchanged]->(:unemployment_rate {id: e1752})-[:exceeds_level]->(:pre_pandemic_level {id: e3321})-[:after_decline]->(:decline {id: e2038}),7
1,"After the euro area reached its pre-pandemic economic level, which exceeded the decline observed in 2020 associated with permanent migrants moving into the area, how did the unemployment rate change?",The unemployment rate in the euro area remained broadly unchanged after it reached the pre-pandemic level.,(:euro_area {id: e375})-[:reached]->(:pre_pandemic_level {id: e3321})-[:after_decline]->(:decline {id: e2038}),(:euro_area {id: e375})-[:reached]->(:pre_pandemic_level {id: e3321})-[:above]->(:_2020 {id: e520})-[:associated_with_decline]->(:permanent_migrants {id: e4171})-[:into]->(:euro_area {id: e375})-[:broadly_unchanged]->(:unemployment_rate {id: e1752})-[:exceeds_level]->(:pre_pandemic_level {id: e3321})-[:after_decline]->(:decline {id: e2038}),7
2,"Did the euro area reach the pre-pandemic level of unemployment after a decline, and how does the unemployment rate compare to the pre-pandemic level reflecting the initial fiscal positions of Member States part of the euro area?","Yes, the euro area reached the pre-pandemic level after a decline, but the unemployment rate broadly remained unchanged and still exceeds the pre-pandemic level.",(:euro_area {id: e375})-[:reached]->(:pre_pandemic_level {id: e3321})-[:after_decline]->(:decline {id: e2038}),(:euro_area {id: e375})-[:reached]->(:pre_pandemic_level {id: e3321})-[:above]->(:_2020 {id: e520})-[:reflecting_initial_fiscal_positions_of]->(:Member_States {id: e2860})-[:part_of]->(:euro_area {id: e375})-[:broadly_unchanged]->(:unemployment_rate {id: e1752})-[:exceeds_level]->(:pre_pandemic_level {id: e3321})-[:after_decline]->(:decline {id: e2038}),7
3,"Did the euro area reach its pre-pandemic level after a period of decline, and is the current inflation rate above what it was in 2020, with the unemployment rate remaining broadly unchanged but exceeding the level it was at before the pandemic?","Yes, the euro area reached its pre-pandemic level after a period of decline. The current inflation rate is above the rate in 2020, which was 1.2 percent. The unemployment rate in the euro area has remained broadly unchanged but exceeds the level it was at before the pandemic.",(:euro_area {id: e375})-[:reached]->(:pre_pandemic_level {id: e3321})-[:after_decline]->(:decline {id: e2038}),(:euro_area {id: e375})-[:reached]->(:pre_pandemic_level {id: e3321})-[:above]->(:_2020 {id: e520})-[:has_inflation_rate]->(:_1_point_2percent {id: e635})-[:is_inflation_rate_for]->(:euro_area {id: e375})-[:broadly_unchanged]->(:unemployment_rate {id: e1752})-[:exceeds_level]->(:pre_pandemic_level {id: e3321})-[:after_decline]->(:decline {id: e2038}),7
4,"Did the euro area reach its pre-pandemic level of economic activity after a decline, and if so, by which time reference was this level aligned with the United States, and how has the unemployment rate in the euro area changed in relation to this pre-pandemic level?","Yes, the euro area reached its pre-pandemic level of economic activity after a decline, and this level was aligned with the fourth quarter of 2019 in the United States. Despite reaching the pre-pandemic level, the unemployment rate in the euro area broadly remained unchanged and exceeds the level before the decline.",(:euro_area {id: e375})-[:reached]->(:pre_pandemic_level {id: e3321})-[:after_decline]->(:decline {id: e2038}),(:euro_area {id: e375})-[:reached]->(:pre_pandemic_level {id: e3321})-[:time_reference]->(:fourth_quarter_of_2019 {id: e538})-[:part_of]->(:United_States {id: e230})-[:aligned_with]->(:euro_area {id: e375})-[:broadly_unchanged]->(:unemployment_rate {id: e1752})-[:exceeds_level]->(:pre_pandemic_level {id: e3321})-[:after_decline]->(:decline {id: e2038}),7
