Nr,path,meaningful,Question,Answer
1,euro area -[imports affected by]-> fertilisers -[related to]-> war in Ukraine -[substantial upside risk to]-> energy prices,"meaningful=True explanation='The path is logical and meaningful as it connects various economic and geopolitical factors. The euro area is impacted by imports of fertilisers, which are influenced by the war in Ukraine. This conflict has significant implications for global supply chains and agricultural inputs, leading to potential increases in energy prices due to disruptions in production and transportation. Each relationship in the path reflects a real-world scenario where economic conditions and geopolitical events are interconnected.'",Are energy prices substantially affected by the war in Ukraine through the import of fertilisers in the euro area?,Yes
2,euro area -[adverse effects due to]-> high inflation -[acting as headwind to]-> growth -[forecast for 2023]-> 2023,"meaningful=True explanation='The path logically connects the euro area to high inflation, indicating that the region is experiencing adverse effects from inflation. This high inflation is then described as a headwind to growth, suggesting that it negatively impacts economic growth. Finally, the path leads to a forecast for 2023, which is a reasonable conclusion based on the previous entities and relationships. Overall, the connections between the concepts are coherent and meaningful.'",Are high inflation and adverse effects acting as a headwind to growth in the euro area for the forecast of 2023?,yes
3,euro area -[R facing economic challenges]-> 2021 -[has rate]-> expected global growth rates for 2021 -[is expected to be]-> 3 point 5percent,"meaningful=True explanation='The path logically connects the euro area facing economic challenges in 2021 to the expected global growth rates for that year, which is quantified as 3.5 percent. Each entity and relationship in the path is relevant and contributes to understanding the economic context of the euro area during that time.'",Did the euro area face economic challenges in 2021 that affected the expected global growth rates?,yes
4,euro area -[compared with]-> United States -[saw rise in]-> inflation -[increased across]-> advanced economies,"meaningful=True explanation=""The path makes logical sense as it describes a comparison between the euro area and the United States, indicating that both regions experienced a rise in inflation. The phrase 'increased across advanced economies' suggests that this inflation trend is not isolated to just these two regions but is a broader phenomenon affecting other developed economies as well. The relationships between the entities are coherent and reflect a meaningful economic analysis.""",Did inflation increase across advanced economies compared to the euro area and the United States?,yes
5,Governing Council -[ensure by adjusting]-> inflation -[change due to]-> energy prices -[towards]-> second half of the decade,"meaningful=True explanation='The path describes a logical sequence of relationships where the Governing Council takes actions to manage inflation, which is influenced by changes in energy prices, and this is contextualized within a timeframe (the second half of the decade). Each entity and relationship connects in a coherent manner, illustrating a cause-and-effect scenario relevant to economic policy.'",Does the Governing Council adjust measures to ensure inflation is influenced by energy prices towards the second half of the decade?,Yes
6,Governing Council -[aiming to counter]-> risks -[related to]-> inflation -[revised up due to]-> war,"meaningful=True explanation='The path makes logical sense as it outlines a sequence of relationships between entities. The Governing Council aims to counter risks, which are related to inflation. The mention of inflation being revised up due to war indicates a causal relationship, suggesting that the war has an impact on inflation levels. Overall, the connections between the entities are coherent and reflect a plausible scenario in economic governance.'",Is the Governing Council aiming to counter risks related to inflation that have been revised up due to war?,Yes
7,Governing Council -[aims to stabilize inflation over]-> medium term -[supported by favorable]-> financing conditions -[maintained for]-> sectors,"meaningful=True explanation='The path describes a logical sequence of relationships between entities involved in economic policy. The Governing Council aims to stabilize inflation over the medium term, which is a common objective for central banks. This stabilization is supported by favorable financing conditions, indicating that access to credit and investment is conducive to achieving this goal. Finally, these favorable conditions are maintained for various sectors, suggesting that the benefits of stable inflation and good financing conditions are intended to support different parts of the economy. Overall, the connections between these entities reflect a coherent economic strategy.'",Does the Governing Council aim to stabilize inflation over the medium term with the support of favorable financing conditions maintained for sectors?,Yes
8,Governing Council -[will maintain throughout the process of normalizing]-> monetary policy -[has interaction with]-> inequality -[moderated during]-> subsequent economic recovery,"meaningful=True explanation=""The path logically connects the Governing Council's role in maintaining monetary policy, which is relevant to addressing inequality, and how these factors interact during the process of economic recovery. Each entity and relationship is coherent and reflects a plausible economic framework.""",Does the Governing Council's maintenance of monetary policy interact with inequality during the process of economic recovery?,Yes
9,ECB -[decline observed in]-> advanced economies -[outside]-> euro area -[had decline in]-> manufacturing activity,"meaningful=True explanation='The path logically connects the European Central Bank (ECB) to advanced economies, indicating that the ECB observed a decline in these economies. It then specifies that the decline is outside the euro area, which is a relevant geographical distinction. Finally, it concludes that this decline is specifically in manufacturing activity, which is a common economic indicator. Each step in the path builds on the previous one, creating a coherent narrative about economic trends.'",Did advanced economies outside the euro area experience a decline in manufacturing activity according to the ECB?,yes
10,ECB -[monetary policy will depend on]-> incoming data -[indicates]-> unprecedented decline -[in]-> global services trade,"meaningful=True explanation='The path logically connects the European Central Bank (ECB) with its monetary policy decisions, which are influenced by incoming data. This data indicates an unprecedented decline in global services trade, suggesting a cause-and-effect relationship. The entities and relationships are coherent and relevant to economic analysis.'",Does the ECB's monetary policy depend on incoming data that indicates an unprecedented decline in global services trade?,Yes
11,ECB -[continue to include flexibility under stressed conditions]-> monetary policy -[affects]-> economic growth -[influenced by]-> strengthening foreign demand,"meaningful=True explanation=""The path logically connects the European Central Bank's (ECB) actions regarding monetary policy to broader economic outcomes. It starts with the ECB's flexibility in monetary policy under stress, which is a relevant and realistic scenario. This flexibility can indeed affect economic growth, as monetary policy is a key tool for managing economic conditions. Furthermore, economic growth can be influenced by external factors such as strengthening foreign demand, making the entire path coherent and meaningful in the context of economic analysis.""",Does the ECB's flexibility under stressed conditions influence monetary policy?,yes
12,ECB -[published]-> analysis -[draws on]-> survey data -[has characteristic]-> publication lag,"meaningful=True explanation='The path makes logical sense as it describes a sequence of relationships between entities in a coherent manner. The ECB (European Central Bank) publishes analyses that draw on survey data, which can indeed have characteristics such as publication lag. Each relationship is relevant and contributes to understanding how these entities interact.'",Does the analysis published by the ECB draw on survey data that has the characteristic of a publication lag?,Yes
13,ECB -[implements policy for]-> euro area -[adverse effects due to]-> high inflation -[can lower the real value of]-> nominal liabilities,"meaningful=True explanation='The path is logical and meaningful as it describes a sequence of relationships in economic terms. The European Central Bank (ECB) implements monetary policy for the euro area, which can lead to adverse effects such as high inflation. High inflation can indeed lower the real value of nominal liabilities, meaning that debts or fixed payments become less burdensome in real terms as inflation rises. Each step in the path connects relevant economic concepts coherently.'",Does high inflation have adverse effects in the euro area according to the ECB's policy implementation?,yes
14,consumption impulse -[not compared with]-> United States -[policy interest rates raised to higher levels than]-> euro area -[exhibit correlation]-> terms of trade,"meaningful=True explanation=""The path describes a logical sequence of economic relationships. It starts with 'consumption impulse', which can influence economic conditions in the 'United States'. The mention of 'policy interest rates raised to higher levels than' indicates a comparative economic policy between the 'United States' and the 'euro area', suggesting that higher interest rates in the U.S. can affect trade dynamics. The 'exhibit correlation' phrase implies a relationship between these interest rates and 'terms of trade', which is a relevant economic concept. Overall, the connections between consumption, interest rates, and trade are coherent and meaningful in an economic context.""",Is the consumption impulse compared with the United States in this path?,No
15,European Commissions Autumn Forecast -[did not fully consider]-> containment measures -[contributed to]-> global economic activity -[had state of]-> weaker footing,"meaningful=True explanation=""The path logically connects the European Commission's Autumn Forecast to the impact of containment measures on global economic activity, ultimately leading to a state of weaker economic footing. Each step in the path builds on the previous one, illustrating a cause-and-effect relationship that is coherent and relevant to economic analysis.""",Did the European Commission's Autumn Forecast fully consider the containment measures?,No